{
  "absicht": "status",
  "bezug": { "projekt": "leitstand", "issue": "SIN-864", "repo": "siinanXD/Leitstand", "pr": 431 },
  "aktion": "antworten",
  "antwort": "SIN-864 ist im Review.",
  "sicherheit": 0.9,
  "kosten": { "quelle": "abo", "tokens_ein": 1200, "tokens_aus": 150, "kosten_eur": 0 },
  "dauer_ms": 2400,
  "quellen": ["https://github.com/siinanXD/Leitstand/pull/431"],
  "zeitpunkt": "2026-10-23T16:00:00Z"
}
